{"$schema":"https://json-schema.org/draft/2020-12/schema","type":"object","required":["schemaVersion","project","paperthin","policies","adapters"],"properties":{"schemaVersion":{"const":1},"project":{"type":"object","required":["name","description"]},"paperthin":{"type":"object","required":["source","ref"]},"policies":{"type":"object","required":["mvpFirst","grillMe","review","testPortability","containerValidation","externalActions"]},"adapters":{"type":"object","required":["active","definitions"]}}}
